FileName,OriginalText,PreprocessedText,Tokens,Sentiment,compound,harsh_label
/content/Untitled Folder/extracted_pdf.raphinha (1).txt,"SPOTLIGHT  |  Page 3
SPOTLIGHT  

MOTORSPORT  |  Page 4
MOTORSPORT  

Bigger and better 
Qatar Racing 
Club season to 
kick off   today

Isle of Man TT 
legend Hillier 
set for Qatar 
International Baja

Thursday, October 24, 2024
Rabia II 21, 1446 AH

GULF TIMES
SPORT

CRICKET

Gambhir backs 
struggling Rahul, 
New Zealand brace 
for trial by spin
Page 2

Faisal scores brace in Qatar U-17’s win over Mongolia

Qatar were made to work hard 
before securing a 2-0 win against 
Mongolia in their AFC U-17 Asian 
Cup 2025 Qualifiers Group F 
match at the Aspire in Doha 
yesterday. Zaid Faisal made a 
captain’s contribution, scoring 
a brace to give Qatar a winning 
start to their campaign.The 
forward opened the scoring in the 
18th minute but any perception 
of the floodgates opening were 
quickly diminished as Mongolia 
put on a resilient display. It took 
Qatar until six minutes from the 
end before they were able to add 
another through Faisal to confirm 
the three points. In another match 
yesterday, Japan thrashed Nepal 
9-2. Next up for Qatar will be 
Nepal tomorrow with Mongolia 
facing Japan.

UEFA CHAMPIONS LEAGUE

Raphinha nets 
hat-trick as Barca 
thrash Bayern 4-1

Haaland acrobatics light up Man City rout of Sparta Prague

GULF CLUB CHAMPIONS LEAGUE

Verratti salvages 
Arabi a point against 
Kuwait’s Qadsia

By Sports Reporter
Doha

Al  Arabi  were  held  to  a 

1-1  draw  by  Al  Qadsia  of 
Kuwait  in  the  opening 
match  of  the  Gulf  Club 
Champions League at the Al Thu-
mama Stadium yesterday.

Marco  Verratti  got  Al  Arabi  the 
equaliser  in  the  71st  minute  af-
ter Igor Rossi had put the Kuwaiti 
side ahead in the 56th minute. The 
Dream Team began their campaign 
in  the  regional  tournament  in  an 
attacking  mode,  with  most  of  the 
pressing coming from them in the 
early minutes of the match.

But  the  tides  appeared  to  be 
turning  gradually  in  Al  Qadsia’s 
favour as the match wore on, with 
their central midﬁ  elder Daniel Aji-
bola,  a  Nigerian  international  in 
particular, proving to be dangerous 
with  his  often  eff  ortless  incursion 
into  Al  Arabi’s  box,  which  caused 
some  headaches  for  the  Qatari 
side’s defence.

Rodri  Sanchez  missed  a  golden 
chance of putting Al Arabi in front 
in  the  25th  minutes  after  his  left-
footed  eff  ort,  following  his  bril-
liant move inside Al Qadsia’s ﬁ  nal 
third, went a bit wide off   the mark.
Al  Arabi  appeared  to  regain  the 
upper  hand  from  thereon  as  they 
launched  waves  of  relentless  at-
tacks on the Kuwaiti side’s defence 
but for all their eff  orts, the match 
was  stalemated  going  into  the 
break.

The hosts began the second half 
from  where  they  stopped,  with 

Sanchez  again  missing  a  sitter  in 
the  51st  minute  after  being  per-
fectly  set  up  by  Ahmed  Alaael-
din  to  the  disappointment  of  the 
bench and stands.

Five minutes later, Al Qadsia got 
the  opening  goal  through  Rossi  to 
the  consternation  of  the  vocifer-
ous Al Arabi supporters.

A stunned Al Arabi went to work 
immediately in search of an equal-
izer and their eff  orts were reward-
ed in the 71st minute when Verratti 
ﬁ  red  home  a  25-yard  thunderbolt 
of a shot following a brilliant pass 
by  Alaaeldin.  The  goal  was,  how-
ever,  contended  by  the  Kuwaitis, 
as  they  claimed  the  ball  was  out 
of  touchline  before  it  was  passed 
to  Alaaeldin.  But  after  a  lengthy 
VAR  check,  the  goal  was  allowed 
to stand.

Despite  Al  Arabi’s  attempt  at 
getting the win, especially in add-
ed  time,  Al  Qadsia’s  defence  en-
sured  that  the  spoils  were  evenly 
shared, with the game ending in a 
1-1 draw.

Al Arabi coach Anthony Hudson 
later said, “I am satisﬁ  ed with the 
performance  of  the  team  against 
Al  Qadsia  though  we  could  have 
achieved  a  better  result  than  a 
draw.”

Al Qadsia coach Zeljko Petrovic 
said: “I believe the draw in today’s 
match  was  fair.  We  faced  a  strong 
opponent, and the outcome of the 
game  was  realistic.  The  second 
group in the tournament is excel-
lent.  We  will  have  tough  matches 
ahead, but I believe the experience 
gained  from  these  tournaments  is 
what truly matters.”

Barcelona’s Raphinha celebrates scoring a goal during the UEFA Champions League match 
against Bayern Munich at the Estadi Olimpic Lluis Companys in Barcelona yesterday. (AFP)

with an eff  ort reminiscent of his strike against 
old club Borussia Dortmund two years ago that 
won Champions League goal of the season.

Savinho’s  chipped  cross  was  slightly  be-
hind the 24-year-old, who contorted his body 
to  strike  the  ball  martial  arts  style  and  ﬁ  re  it 
past  Vindahl.  Stones  nodded  in  a  vital  stop-
page  time  winner  against  Wolves  in  the  Pre-
mier League on Sunday and continued his hot 
streak  in  front  of  goal  with  a  looping  header 
from Nunes’ cross. 

Haaland  then  completed  a  three-goal  blitz 
in 11 minutes at the end of a scintillating City 
counter-attack.

Slick  passes  from  Rico  Lewis,  Foden  and 
Nunes teed up Haaland to slot home his 44th 
Champions League goal in just 42 appearances 
in the competition.

Guardiola could aff  ord the luxury of replac-
ing  his  star  number  nine,  along  with  Ilkay 
Gundogan  and  Bernardo  Silva  in  the  closing 
stages with City in the midst of a run of seven 
games in 21 days.

Nunes completed the rout from the penalty 

spot after he had been felled inside the area.

Victory  takes  City  onto  seven  points  from 
their opening three Champions League games, 
behind  only  Premier  League  rivals  Liverpool 
and Aston Villa.

NUNEZ EARNS LIVERPOOL 
NARROW WIN AT LEIPZIG
Liverpool’s Darwin Nunez took full advantage 
of a rare start with the winner in his side’s 1-0 
victory at RB Leipzig as their 100% start in the 
Champions League continued yesterday.

With Diogo Jota ruled out because of injury, 
Uruguayan  Nunez  got  his  chance  and  deliv-
ered in the 27th minute by poking home Mo-
hamed Salah’s header. It proved enough to se-
cure Liverpool’s sixth away win out of six in all 
competitions this season and maintain an ex-
cellent start to new manager Arne Slot’s reign.
Liverpool are second in the 36-team league 
phase with nine points, behind only Aston Vil-
la  on  goal  diff  erence.  Leipzig  twice  had  goals 
disallowed and wasted several other promising 
moments as their wait for a ﬁ  rst point goes on.

RESULTS:
Atalanta 0 Celtic 0
Brest 1 Bayer Leverkusen 1
Atletico Madrid 1 Lille 3
Barcelona 4 Bayern Munich 1
Benfica 1 Feyenoord 3
Manchester City 5 Sparta Prague 0
RB Leipzig 0 Liverpool 1
RB Salzburg 0 Dinamo Zagreb 2
Young Boys 0 Inter Milan 1

Al Arabi’s Marco Verratti (right) and Al Qadsia’s Daniel Ajibola vie for the 
ball during their Gulf Club Champions League match at the Al Thumama 
Stadium yesterday. PICTURE: Noushad Thekkayil

Agencies
Barcelona

Barcelona  captain  Raphinha  scored  a 

hat-trick to lead them to a command-
ing 4-1 home victory over Bayern Mu-
nich  in  the  Champions  League  yes-
terday, ending a near decade-long winless run 
against the German powerhouses.

Raphinha’s  inspired  night  started  when  he 
gave Barca the lead a little over a minute after 
kick-off   as he received a ﬁ  ne pass through by 
midﬁ  elder Fermin Lopez, beat the off  side trap 
before rounding the onrushing Manuel Neuer 
and tapping into the empty net.

Harry Kane levelled the score with a volley 
in  the  18th  minute  but  Robert  Lewandowski 
put  the  home  side  back  in  front  in  the  36th 
minute  after  a  mistake  by  Bayern’s  defence 
and Raphinha extended Barca’s lead with two 
goals  from  quick  counter-attacks  either  side 
of  halftime.  Barca  are  ninth  in  the  Champi-
ons League standings on six points from three 
games  while  Bayern  are  23rd  on  three  points 
after a second consecutive defeat.

HAALAND BRACE 
Erling  Haaland’s  spectacular  acrobatic  eff  ort 
lit  up  Manchester  City’s  5-0  win  over  Sparta 
Prague to move into third place in the Cham-
pions League table.

The  Norwegian  scored  twice,  including  a 
backheel  at  shoulder  height,  as  City  ran  riot 
against  the  Czech  champions.  Phil  Foden, 
John Stones and Matheus Nunes were also on 
target  for  Pep  Guardiola’s  men,  who  remain 
unbeaten in all competitions this season.

Sparta  had  taken  four  points  from  their 
opening two Champions League games against 
Salzburg and Stuttgart, but City were a step up 
in class too far for the visitors.

Foden’s  struggle  for  form  and  ﬁ  tness  has 
compounded City’s injury problems with Ro-
dri and Kevin De Bruyne sidelined.

But there were encouraging signs for Guar-
diola  as,  restored  to  the  starting  line-up,  the 
England international drilled home the open-
ing goal after just three minutes.

Haaland  had  nine  eff  orts  on  goal  in  total 
but  was  frustrated  in  the  ﬁ  rst  half  as  Sparta 
refused  to  let  the  ﬂ  oodgates  open  before  the 
break. Peter Vindahl produced a stunning save 
low to his right to parry a powerful downward 
header from Haaland on 10 minutes.

Vindahl  also  denied  Foden,  while  Haaland 
had  another  towering  header  hacked  off    the 
line.

For  all  the  home  side’s  dominance,  Sparta 
would have levelled midway through the ﬁ  rst 
half  but  for  a  brilliant  save  from  Ederson  to 
turn behind Veljko Birmancevic’s strike on the 
counter-attack from a City corner.

Haaland  did  ﬁ  nally  deliver  City’s  second 

 
2

Gulf Times 
Thursday, October 24, 2024

CRICKET

PREVIEW

Gambhir backs 
Rahul as NZ brace 
for trial by spin

‘I think he is batting very well and had a decent knock in Kanpur’

Reuters
Pune

India  head  coach  Gautam 

Gambhir backed KL Rahul to 
regain his batting form, while 
New  Zealand  prepared  for  a 
trial by spin in the second test be-
tween the sides beginning today.
India’s proud record of not los-
ing  a  single  Test  series  on  home 
soil since 2012 is on the line after 
New  Zealand  beat  them  by  eight 
wickets  in  the  series  opener  in 
Bengaluru.

The hosts were bundled out for 
46 in the ﬁ  rst innings and a vastly 
improved  462  in  the  second  was 
not  enough  to  prevent  New  Zea-
land  from  going  1-0  up  in  the 
three-test series.

Rahul,  who  was  trolled  on  so-
cial media after his scores of zero 
and  12  in  Bengaluru,  appears  to 
have  slipped  behind  Sarfaraz 
Khan  in  India’s  batting  pecking 
order.

Sarfaraz  smashed  a  rapid  150 
in  the  second  innings  to  justify 
his  selection  after  Shubman  Gill 
missed  the  match  with  a  stiff  
neck.

Gambhir conﬁ  rmed a ﬁ  t-again 
Gill  would  resume  his  place  but 
also  backed  Rahul,  who  smashed 
a half century against Bangladesh 
in  Kanpur  last  month,  to  come 
good.

“Social  media  does  not  mat-
ter  one  bit,”  former  India  opener 
Gambhir told reporters yesterday.

India’s Virat Kohli, Yashasvi Jaiswal (second from right), KL Rahul (right) and Dhruv Jurel (left) attend a 
practice session on the eve of the second Test against New Zealand at the Maharashtra Cricket Association 
Stadium in Pune. (AFP)

“What  the  team  management 
and  leadership  group  thinks  is 
very important.

“I think he is batting very well 
and had a decent knock in Kanpur 
on a diffi    cult wicket.

“I  am  sure  he  also  wants  to 
score big runs and he has the ca-
pability  of  scoring  runs.  That’s 
why  he  has  been  backed  by  the 
team...”

Given  the  presence  of  several 
left-handed  batters  in  the  New 
Zealand  lineup,  India  are  also 
considering  playing  off  -spinner 

Washington  Sundar,  the  coach 
added.

Gambhir  said  ﬁ  nalising  In-
dia’s  playing  XI,  which  would 
be revealed at today’s toss, was a 
“challenge”  as  well  as  indicative 
of the depth in the side.

He also praised India’s fearless 
batting in the second innings de-
spite the ﬁ  rst-innings collapse.

New  Zealand,  meanwhile,  ex-
pect  an  under-pressure  India  to 
revert to their traditional strength 
and  roll  out  a  turning  track  in 
Pune.

“We  had  a  brief  look  at  (the 
pitch)  yesterday,”  said  New  Zea-
land  all-rounder  Rachin  Ravin-
dra.

“It  deﬁ  nitely  looked  very  dry, 

very spin-friendly.

“It’s  something  we  thought 
they’d  do  after  that  test.  Hon-
estly,  we’ve  just  got  to  adapt  to 
what’s in front of us.

“For  us,  it’s  about  adapting  to 
what’s in front of us, making that 
early  read  and  hopefully  we  can 
make  those  changes  if  need  be,” 
Ravindra said.   

WORLD CUP QUALIFIER

Zimbabwe set T20I 
records in massive win

Reuters
Harare

Sikandar  Raza  smashed 

an unbeaten 133 in 43 balls 
as  Zimbabwe  set  a  record 
innings  score  of  344  for 
four  in  their  T20  World  Cup  sub 
regional  Africa  qualiﬁ  er  against 
Gambia yesterday, and went on to 
claim the largest win in the format.
Raza launched 15 sixes in Nairobi 
to  score  his  maiden  T20  Interna-
tional century and take Zimbabwe 
to a new highest total in 20 overs, 
beating  the  previous  best  mark 
of  314  for  three  by  Nepal  against 
Mongolia last year.

They  bowled  The  Gambia  out 
for 54 in 14.4 overs, earning victo-
ry by 290 runs, again eclipsing the 
previous record winning margin of 
273 by Nepal against Mongolia.

Zimbabwe’s  27  sixes  in  the  in-
nings is also a record, edging Nepal 
by one.

Raza  reached  his  century  in  33 
deliveries  and  is  the  ﬁ  rst  player 
from Zimbabwe to make a ton in an 
international match in the format.
Openers Brian Bennett (50) and 

Tadiwanashe  Marumani  (62)  put 
on  98  for  the  ﬁ  rst  wicket  from 
34  balls,  before  Raza  and  Clive 
Madande (53 not out) smashed an 
unbeaten  141  in  40  deliveries  for 
the  ﬁ  fth  wicket.  No  bowler  was 
spared, but seamer Musa Jobarteh 
conceded  93  from  his  four  overs, 
an unwanted T20 record. 

Earlier 

yesterday,  Canter-
bury  opener  Chad  Bowes  broke 
the  record  for  the  fastest  double 
century  in  men’s  List  A  matches, 
reaching his double ton in 103 balls 
against Otago.

New fi  ve-team T20 league starts 
in Guyana on November 26

Guyana: Franchises from 
cricket’s five leading nations will 
be fighting it out for a $1mn prize 
money when a new T20 league 
kicks off  in Guyana next month 
in further proof of the format’s 
growing popularity.
Three-times Vitality Blast cham-
pions Hampshire Hawks are 
among the five teams compet-
ing in the Global Super League 
(GSL) to be played between Nov. 
26 and Dec. 6, organisers said 
yesterday.
All the matches will be played at 
the Guyana National Stadium in 
Providence.
Caribbean Premier League 
side Guyana Amazon Warriors, 
Rangpur Riders of Bangladesh, 

Victoria in Australia, and Paki-
stan Super League team Lahore 
Qalanders are the other sides in 
the tournament.
“We are looking forward to 
welcoming the teams to our 
beautiful country where we are 
sure the action on the field will 
be fantastic,” GSL chairman and 
former West Indies captain Clive 
Lloyd said in a statement yester-
day. “These are five well known 
cricketing entities.” 

The competing teams:
Hampshire Hawks – England
Guyana Amazon Warriors – WI
Lahore Qalandars – Pakistan
Rangpur Riders – Bangladesh
Victoria – Australia

Asalanka stars as Sri Lanka beat 
West Indies in second ODI

Pallekele, Sri Lanka: Skipper 
Charith Asalanka struck an un-
beaten half-century as Sri Lanka 
defeated the West Indies by five 
wickets in the second one-day 
international yesterday to clinch 
the three-match series.
Chasing a tricky 190, Sri Lanka 
reached the target with 34 balls 
to spare at the Pallekele stadium, 
with Asalanka making an un-
beaten 62 off  61 balls.
The match was reduced to 
44-overs a side after the start 
was delayed by two hours be-
cause of rain.
Sri Lanka lost two early wickets 
but they were rescued by a third 
wicket stand of 62 between Nis-
han Madushka (38) and Sadeera 
Samarawickrama (38).
Asalanka then saw the team 
through with his doughty knock 
that included one six and seven 
fours.
He also brought up his 14th ODI 
half-century in the process and 
shared a stand of 55 with Janith 
Liyanage (24) for the fifth wicket.
This was Asalanka’s second 
consecutive half-century, follow-
ing his match-winning 77 in the 
first ODI.
The victory secured a 2-0 series 
win for the hosts, having won the 
opening game by five wickets on 
Sunday.
This was also the fifth successive 
bilateral ODI series win for Sri 
Lanka this year and the tenth 

BOTTOMLINE

consecutive home series victory.
“I am happy to score some runs 
and help the team win,” said 
Asalanka. “It’s been a dream 
run for us in the last couple of 
months. We want to keep win-
ning.”
The third and final match will 
be played at the same venue on 
Saturday.
“The series is lost but hopefully 
we can salvage some pride,” said 
West Indies captain Shai Hope.
“Our spinners need to take a leaf 
out of the Sri Lankan spinners’ 
books.”
Earlier, Sherfane Rutherford (80) 
shared a record 119-run partner-
ship for the ninth wicket with 
Gudakesh Motie (50 not out) to 
lift West Indies from a precarious 
58-8 after they were put in to bat 
in overcast conditions.
This was the highest ninth-wick-
et partnership for West Indies in 
one-day internationals, eclipsing 
the 85-run stand between Yan-
nic Cariah and Alzarri Joseph 
against New Zealand in Barba-
dos in 2022. Rutherford, dropped 
twice, hit four sixes and seven 
fours in his 82-ball knock.

BRIEF SCORES
Sri Lanka 190 for 5 (Asalanka 
62*, Joseph 2-30) beat West 
Indies 189 all out (Rutherford 
80, Motie 50, Hasaranga 4-40, 
Theekshana 3-25, Fernando 3-35) 
by five wickets

FIRST TEST

Miraz hits 87 as Bangladesh fi  ght back puts 
them back into contest against South Africa

Reuters
Mirpur

Middle  order  batsman 

Mehidy  Hasan  Miraz 
led a Bangladesh ﬁ  ght 
back  with  an  unbeat-
en 87 on the third day of the ﬁ  rst 
Test  against  South  Africa  yester-
day  to  turn  a  precarious  position 
into a tight contest.

Bangladesh  were  283  for  seven 
in their second innings when bad 
light brought play to a premature 
close  at  the  Sher-e-Bangla  Na-
tional  Cricket  Stadium,  leading 
South Africa by 81 runs with three 
wickets in hand.

Mehidy and Nayeem Hasan (16 
not out) will resume today, look-
ing to set South Africa an impos-
ing target on a variable pitch.

Bangladesh, who were 202 runs 
behind  the  visitors  after  the  ﬁ  rst 
innings, looked headed for an in-
nings defeat when they lost three 
early  wickets  yesterday,  slump-
ing  from  their  overnight  score  of 
101-3  to  112-6  as  Kagiso  Rabada 
grabbed  two  scalps  and  Keshav 
Maharaj  claimed  the  wicket  of 
Litton Das.

Rabada  had  opener  Mahmudul 
Hasan  Joy  caught  for  40  at  ﬁ  rst 
slip in the ﬁ  fth over of the day and 
then  two  balls  later  clean  bowled 

Bangladesh’s Mehidy Hasan Miraz (left) plays a shot during the third day of the first Test against South Africa 
at the Sher-e-Bangla National Cricket Stadium in Dhaka yesterday. (AFP)

Mushﬁ  qur Rahim. Litton Das was 
caught  behind  by  wicketkeeper 
Kyle  Verreynne  off    Maharaj  but 
the  original  appeal  was  turned 
down. South Africa captain Aiden 
Markram  almost  ran  out  of  time 
before requesting a review, which 
proved successful.

Mehidy  and  debutant  Jaker  Ali 
then  off  ered  stiff    resistance  with 
an  aggressive  approach  and  put 
on  a  138-run  partnership  for  the 
seventh wicket to see off   Bangla-

desh’s  deﬁ  cit  and  off  er  their  side 
hope of a turnabout in fortunes.

Mehidy  brought  up  his  half 
century  in  94  balls,  followed  by 
Jaker, who took 104 balls to get to 
50.  He  was  then  snagged  leg  be-
fore wicket to Maharaj for 58.

Rain halted play as South Africa 
were about to be off  ered the sec-
ond new ball and tea taken earlier 
than scheduled. 

When  they  returned  after  a 
lengthy  delay,  the  umpires  said 

the light was not good enough for 
South Africa to use their seamers.
Surprisingly,  the  visitors  con-
tinued with a spin attack, instead 
of  taking  the  bad  light,  allowing 
Bangladesh to add 16 runs in ﬁ ve 
overs before play was called off  .

BRIEF SCORES (Day 3)
Bangladesh 106 and 283 for 7 
(Mehidy 87*, Jaker 58, Rabada 
4-35) lead South Africa 308 by 
81 runs

Captain Stokes forecasts spin battle in Pakistan-England decider in Rawalpindi

AFP
Rawalpindi

the 

England  captain  Ben  Stokes 

series-de-
believes 
ciding  third  Test  against 
today 
Pakistan  starting 
will  boil  down  to  a  spin  battle  on 
a Rawalpindi pitch likely to favour 
slow bowlers.

England’s captain Ben Stokes (right) attends a practice session on the eve of their third and final Test against 
Pakistan in Rawalpindi. (AFP)

England piled up 823-7 to thrash 
Pakistan by an innings on a lifeless 
Multan  pitch  in  the  ﬁ  rst  Test,  be-
fore  the  hosts  bounced  back  with 
a  152-run  win  on  a  recycled  and 
turning Multan track.

For the deciding match, Pakistan 
have kept the same combination of 
three  frontline  spinners  in  Sajid 
Khan, Noman Ali and Zahid Mah-
mood, with just one fast bowler in 

Aamer  Jamal.  Pakistan  have  used 
industrial  fans  and  heaters  to  dry 
the  Rawalpindi  pitch,  hoping  to 
replicate  their  spin-led  success  in 
Multan  which  ended  a  drought  of 
home wins stretching back to 2021.
Stokes said his three spinners in 
Jack  Leach,  Shoaib  Bashir  and  the 
recalled  Rehan  Ahmed  were  equal 
to the challenge.

“I’ll  be  backing  the  three  spin-
ners  that  we’ve  picked,”  Stokes 
told reporters after a training ses-
sion on the eve of the third and ﬁ  -
nal Test.

“We don’t know exactly how the 
wicket  will  play,  but  we’ve  taken 
as much information from it as we 
can.

“We  think  the  longer  the  game 
goes, the more spin will come into 
play.”

Pakistan  head  coach 

Jason 
Gillespie, the former Australia fast 
bowler, also expects the near-bald 
pitch  “to  favour  the  slower  bowl-
ers”.

The  toss  could  be  crucial,  with 
both teams looking to bat ﬁ  rst and 
maximise the impact of their spin-
ners on a deteriorating pitch.

Pakistan have performed poorly 
in all formats in the past year, los-
ing  2-0  in  a  home  Test  series  to 
Bangladesh and crashing out of the 
ODI and Twenty20 World Cups in 
the ﬁ  rst rounds.

A  series  victory  over  England 
would mark a stark change in for-
tunes.

“Over  the  last  few  years  Pa-
kistan’s  Test  cricket  hasn’t  been 
where we’d like it to be, so any win 
is a positive,” he said. 

Gulf Times 
Thursday, October 24, 2024

3

SPORT

MOTORSPORT

Bigger and better QRC 
season to kick off   today

FIRST ROUND OF QATAR DRIFT CHAMPIONSHIP IS THE SEASON OPENER

By Sports Reporter
Doha

Qatar  Racing  Club  (QRC) 

for  another 
is  ready 
thrilling  season  full  of 
competitions 
exciting 
with  the  ﬁ  rst  event  kicking  off  
with  the  opening  round  of  Qatar 
Drift Championship today.

The  events  are  held  under  the 
patronage  of  QRC  Chairman  HE 
Sheikh Khalid bin Hamad al-Thani. 
The  club  held  two  days  of  testing 
to  prepare  for  the  new  season  last 
week. 

The  ﬁ  rst  day  focused  on  drift 
racers  testing  their  cars  for  readi-
ness, while the second day was al-
located to 4X4 freestyle racers. 

The  QRC  said  all  preparations 
have  been  completed  for  what  is 
expected to be an exceptional sea-
son.  The  new  season  is  featuring 
diverse  championships, 
intense 
competition, and eff  orts to attract 
a  larger  audience  of  motorsport 
enthusiasts. 

This aligns with the vision of the 
QRC Chairman HE Sheikh Khalid, 
who is dedicated to placing Qatar’s 
motorsport on the global map. 

Special attention has been given 
to the sports events calendar, aim-
ing to elevate the club, diversify its 
activities,  and  attract  more  par-
ticipants.  QRC  General  Manager 
Sheikh  Jabor  bin  Khalid  al-Thani 
said the club will feature the larg-
est number of events in its history, 
which  will  strengthen  QRC’s  sta-
tus  as  the  home  of  drag  racing  in 
the Middle East. 

“This year, the club is organising 

QRC General Manager Sheikh 
Jabor bin Khalid al-Thani 

two separate drag racing champi-
onships.  The  ﬁ  rst  is  the  Arabian 
Drag  Racing  League,  which  takes 
on  an  international  ﬂ  avour  and 
features participation from global 
champions of the sport,” he said. 

The  event  consists  of  six 
rounds, with the ﬁ  rst set for Janu-
ary 9 and 10, continuing until the 
ﬁ  nal round in mid-February. 

“The  second  championship  is 
the  Qatar  Drag  Racing  Champi-
onship,  consisting  of  ﬁ ve  rounds 
where  top  drag  racers  from  the 
Middle East compete. 

The  opening  round  will  take 
place  one  week  after  the  conclu-
sion  of  the  Arabian  Drag  Racing 
League, and it will conclude in the 
last  third  of  March  2025,”  Sheikh 
Jabor said. 

Additionally,  the  Qatar  Sand 
Drag  Competition  will  be  held  at 
the  Sealine  Sand  Track,  featur-
ing  ﬁ ve  rounds  starting  in  mid-

Action from last year’s Qatar 
Drift   Championship.

November and concluding in April 
2025.  Fans  of  freestyle  and  two-
wheel  stunts  will  enjoy  a  four-
round championship, and the club 
will  also  host  roll  races  and  open 
