FileName,OriginalText,PreprocessedText,Tokens,Sentiment,compound,harsh_label
the  Motocross  track  for  enthusi-
asts. Reﬂ  ecting the growing global 
interest  in  electric  sports,  electric 
scooter  races  will  also  be  part  of 
the season, he said. 

The  season  will  also  witness 
several  electric  scooter  races,  re-
ﬂ  ecting  the  growing  global  inter-
est and signiﬁ  cant development in 
electric sports in recent times.

“We  made  sure  to  ﬁ nalise  the 
sports  events  calendar  for  the  new 

2024/2025  season  early  on  to  give 
racers  the  opportunity  to  prepare 
for  the  competitions,  as  we  are 
aiming  for  an  exceptional  season 
in every aspect. Our goal is to build 
an educated and aware community, 
and this approach reﬂ  ects the vision 
of  the  club’s  chairman,  His  Excel-
lency Sheikh Khalid bin Hamad al-
Thani, which is to continue building 
a youth base capable of steering Qa-
tar towards more achievements that 
represent  the  Gulf  region  and  Arab 
countries,”  said  the  QRC  general 
manager,  who  is  deeply  passionate 
about motorsport. 

“The  club  is  always  keen  to 

welcome  Gulf,  Arab,  and  foreign 
teams. Under the guidance of our 
club  chairman,  we  ensure  that 
these teams are provided with the 
right  conditions,  positively  im-
pacting  the  competitions.  This 
fact  is  well  recognized  by  every-
one, and it has set our club apart, 
making  it  a  shining  beacon  in  the 
history  of  this  sport  at  both  Gulf 
and international levels.”

He  added:  “In  addition  to  the 
races,  we  are  accustomed  to  or-
ganizing  events  and  exhibitions 
related to cars and motorcycles at 
the club, with a focus on support-
ing  young  people  and  enthusiasts 

of  excellence  and  creativity.  The 
goal is for the club to always serve 
as a platform that brings together 
car  and  bike  lovers  in  one  place 
along  with  companies  and  sup-
porting entities. 

“At the forefront of these events 
is  the  Qatar  Custom  Show,  which 
we  will  organise  for  the  12th  edi-
tion this season, from January 14th 
to 18th, 2025. We are also keen on 
hosting  several  gatherings  for  car 
owners  and  motorcycle  groups. 
As usual, there will also be special 
events to celebrate National Sport 
Day  and  the  National  Day  of  the 
State.”

Chebli, Alawar win in final round 
of Qatar National Sprint

FORMULA 1 

Verstappen carries momentum 
back to a favourite track

Reuters
Mexico City

Max  Verstappen  has 

won  ﬁ ve  of  the  last 
six  grands  prix 
in 
Mexico  and  while 
Ferrari  will  fancy  their  chances 
this weekend, the Red Bull driver 
can take another big step towards 
a fourth Formula One title.
Verstappen  arrives  at 

the 
high-altitude  Hermanos  Rod-
riguez  circuit  57  points  clear  of 
McLaren’s  Lando  Norris  with 
ﬁ ve  rounds  remaining.  Norris 
described ﬁ  nishing fourth at last 
Sunday’s  US  Grand  Prix  in  Aus-
tin,  with  Verstappen  third,  as  a 
‘momentum  killer’  in  the  title 
battle  while  Red  Bull  saw  a  po-
tential turning point.

The  result  was  the  ﬁ  rst  time 
in ﬁ ve races that Verstappen had 
beaten Norris, and the Briton has 
yet  to  ﬁ  nish  higher  than  ﬁ  fth  in 
Mexico.  “We  have  historically 
done well here and I have always 
enjoyed  driving  at  this  track,” 

said  Verstappen  of  a  layout  that 
equals Austria’s Red Bull Ring as 
his most successful.

“We made some good steps in 
Austin  and  saw  some  promising 
improvements  with  the  car...it 
will  be  about  keeping  this  mo-
mentum  heading  forwards  and 
continuing to gain crucial points 
in the championship.”

The  constructors’  title  is  far 
more  open,  with  Ferrari  poised 
to  overtake  Red  Bull  for  second 
place  after  Charles  Leclerc  and 
Carlos Sainz ﬁ  nished one-two in 
Texas  to  reduce  the  gap  to  eight 
points.  The  pair  swept  the  front 
row  in  Mexico  last  year,  with 
Leclerc on pole.

Red  Bull  need  Sergio  Perez  to 
produce  the  points  in  his  home 
race and turn around a dire run of 
form that has seen him score only 
150 points to Verstappen’s 354.

Perez’s  tally  is  the  lowest  of 
any driver in the top four teams, 
with  nothing  better  than  sixth 
since  Miami  in  May  and  serious 
questions raised about his future 
despite  a  contract  extension  for 

2025  and  2026.  “The  important 
thing is to be able to shut out the 
noise  off    track  and  focus  on  the 
job in hand,” he said. “Ultimately 
the special thing for me would be 
to deliver another podium for my 
fans and my country, at home.”

With  Ferrari  looking  strong, 
and  Perez  needed  to  help  Ver-
stappen  in  his  battle  with  Nor-
ris, the Mexican’s hopes of a top 
three ﬁ  nish even if he recovers his 
form would seem unlikely.

Leclerc  and  Sainz  have  plenty 
to  be  optimistic  about  as  they 
chase  Ferrari’s  ﬁ  fth  win  of  the 
season.  Mercedes’  Lewis  Ham-
ilton  is  the  only  current  driver 
other  than  Verstappen  to  win  in 
Mexico,  the  seven-times  world 
champion  taking  his  2017  and 
2018  titles  there.  “After  a  diffi    -
cult  weekend  in  Austin,  we  have 
the  opportunity  to  bounce  back 
immediately,”  said  team  boss 
Toto Wolff  . “Our performance in 
Texas showed that there is inher-
ent  performance  in  the  car.  Our 
challenge  is  extracting  this  con-
sistently.”

Al Ahli beat Al Shamal to enter 
Qatar Cup basketball semi-finals

With the help of 
Raekwon Deshawn 
Rogers match-high 
25 (9 rebounds, 2 
assists) points Al 
Ahli defeated Al 
Shamal 93-70 at the 
Gharafa Stadium to 
enter the semi-
finals of the Qatar 
Cup basketball 
tournament 
yesterday. Bruce 
Massey Jr also 
scored 16 points, 
while Moustapha 
Ndao contributed 
14. For Al Shamal, 
Brandon Desmond 
and Faris Avdic 
netted 22 and 13 
points each. Al 
Ahli will take on Al 
Gharafa, while de-
fending champions 
Al Arabi will meet 
Al Sadd in the semi-
finals on Saturday.

The 2024 Qatar National Sprint season concluded with the sixth and final round at the open parking lot 
beside Lusail Sports Arena. The popular series, organised by the Qatar Motor & Motorcycle Federation, 
saw Mansour Chebli of Lebanon leading the way in Class O1, with a 46.632-second lap in his Renault Clio, 
followed by Charbel Chebli and Qatar’s Ayad al-Okar. Class O2 saw Jad Alawar from Lebanon win in his 
EVO 8, while Amro Abdulla of Qatar came second in a Subaru. Class O3 was secured by Maher Serre in his 
Nissan 350Z, followed by Aleksandar Jokic and Paige De Jager. Qatar’s Nadim Ziade took the P1 class with a 
48.268-second lap, narrowly beating Mansour Chebli. In P2, Ziade continued to shine, securing another win 
with a time of 47.066. P3 was won by Francesco Fornaciari in a Lotus Exige. In the Women’s event, Melina 
Jokic secured a dominant win with a time of 53.711 seconds, ahead of De Jager and Nasmee’a Christian.

BASKETBALL

LeBron, Bronny make NBA history 
with father-son appearance
LeBron  and  Bronny  James 

made  NBA  history  yester-
day, becoming the ﬁ  rst fa-
ther-and-son  duo  to  play 
alongside  each  other  in  a  regular 
season  ﬁ  xture  as  the  Los  Ange-
les Lakers opened their campaign 
against  the  Minnesota  Timber-
wolves.  The  duo,  who  played  to-
gether brieﬂ y in a pre-season game 
earlier  this  month,  took  to  the 
court  together  late  in  the  second 
quarter  at  the  Crypto.com  Arena 
with  the  Lakers  leading  51-35.  An 
enormous  roar  went  up  from  the 
home crowd as the James duo were 
brought onto the court by coach J J 
Redick after the Lakers had surged 
into a double-digit lead.

In a perfectly scripted moment 
that  was  pure  Hollywood,  the 
James’  double-act  was  watched 
at courtside by Ken Griff  ey Sr and 
Ken  Griff  ey  Jr,  who  made  base-
ball  history  playing  for  the  Seat-
tle  Mariners  as  father  and  son  in 
1990-1991.  “We  made  history; 
now we get to watch history,” said 

LeBron James and Bronny James of the Los Angeles Lakers 
on defence during the second quarter against the Minnesota 
Timberwolves in Los Angeles, California. (AFP)

Griff  ey  Jr,  who  joined  his  father 
to  pose  for  photos  with  LeBron 
and  Bronny  James  shortly  before 
Tuesday’s  tip-off  .  Lakers  offi    cials 
had  been  coy  before  Tuesday’s 
season-opener  about  where  and 
when  LeBron  James  and  Bronny 
would play their ﬁ  rst regular sea-
son ﬁ  xture together.

However,  NBA  superstar  LeB-
ron  James,  who  turns  40  in  De-
cember,  admitted  in  pre-game 

remarks  that  he  could  scarcely 
contain  his  excitement  at  the 
prospect  of  realising  his  long-
cherished  dream  of  sharing  a 
court  with  his  son.  “Just  to  run 
out the tunnel knowing that he’ll 
be in uniform, run out the tunnel 
with  him,  see  him  warm  up,  and 
be  out  there  with  the  rest  of  my 
teammates,”  James  told  reporters 
during  a  morning  shoot-around 
on Tuesday.

Thursday, October 24, 2024

GULF TIMES

MOTORSPORT

SPORT

Isle of Man TT Legend Hillier set for Qatar International Baja

By Sports Reporter
Doha

Isle  of  Man  TT  legend  James  Hillier 

is  heading  to  Doha  next  week  to  take 
part in the Qatar International Baja for 
the  ﬁ  rst  time.  The  three-day  event  is 
based  out  of  the  Lusail  Sports  Arena  and 
is  the  sixth  counting  round  towards  both 
the FIA World Baja Cup and the FIM Bajas 
World Cup. 

Bournemouth-based  Hillier,  39,  is  one 
of the world’s leading motorcycle road rac-
ers but he also took part in the Malles Moto 
section  of  the  2023  Dakar  Rally  without 
service support. Better known for his suc-
cesses at the Isle of Man TT and the North 
West 200, Hillier will face a totally diff  er-
ent  challenge  across  the  winding  gravel 
trails in Qatar, where outright speed needs 
to be combined with excellent navigational 
skills to achieve top results. 

Hillier began riding at the tender age of 
four  and  started  competing  in  trials  two 
years later. By the age of 17, the Hampshire 
rider had moved into the Virgin Mobile R6 
Cup, ﬁ  nishing fourth in 2004, before mov-

FOOTBALL

bike, Senior and Superstock categories and 
is currently seventh fastest rider of all time 
with  a  best  average  speed  of  132.414mph 
for the gruelling Mountain Course.

Hillier  also  has  nine  podiums  at  the 
North West 200, the highlight being a Su-
perstock  victory  in  2019  when  he  earned 
the  Man  of  the  Meeting  award.  He  is  also 
a top 10 ﬁ  nisher at the Macau Grand Prix. 

One  of  the  main  reasons  that  Hillier 
is  competing  in  Qatar  is  to  ﬁ  ne  tune  his 
off  -road  riding  and  navigational  skills  in 
advance of a second attempt at the Dakar 
Rally in Saudi Arabia with WTF Racing in 
January 2025. He has been tackling events 
such as the Setra Enduro during the course 
of the year to get his physical ﬁ  tness up to 
speed before the epic desert challenge.

The  Qatar  International  Baja  is  being 
organised by the Qatar Motor & Motorcy-
cle Federation (QMMF) and will run under 
the chairmanship of QMMF President Ab-
dulrahman al-Mannai, QMMF’s Executive 
Director Amro al-Hamad and board mem-
ber Abdulrazaq al-Kuwari. 

The  full  entry  list  for  both  the  FIA  and 
FIM  sections  of  the  Qatar  International 
Baja will be announced today.

ing into the British Supersport and British 
Superstock 1000 Championships. 

James  had  a  fascination  for  road  racing 
and  his  ﬁ  rst  appearance  at  the  world-fa-
mous TT meeting on the Isle of Man came 
in 2008. He competed in a pair of Super-
sport events for Jackson Racing, ﬁ  nishing 
a modest 19th and 17th on his debut. Lap-
ping  with  an  average  speed  in  excess  of 
119mph,  he  was  awarded  the  prestigious 
Newcomers’  Trophy  during  a  successful 
10-year  spell  with  the  Bournemouth  Ka-
wasaki Team.

Hillier went on to earn his ﬁ  rst podium in 
2012 and then claimed a win in the Light-
weight TT. He now has ﬁ ve podium ﬁ  nishes 
to his name across the Supersport, Super-

Man United ‘will 
succeed sooner or 
later’: Mourinho

MOURINHO MANAGED UNITED BETWEEN 2016 AND 2018

AFP
Istanbul

Jose  Mourinho  says  struggling  Man-

chester United “will succeed sooner or 
later”  as  the  Fenerbahce  boss  prepares 
to take on his former club in the Europa 
League today. United manager Erik ten Hag is 
under pressure after a poor start to the season, 
which has included draws in their ﬁ  rst two Eu-
ropean  matches  –  against  Twente  and  Porto. 
But Mourinho, who has also managed a string 
of other high-proﬁ  le clubs including Chelsea, 
Real  Madrid  and  Tottenham,  said  United  had 
potential and he wants them to succeed.

“Maybe you English guys think I’m bluffi    ng, 
think I am playing mind games,” he said at his 
pre-match press conference. 

“I’m  not  playing  anything  –  they  have  a 
better  team  than  the  results  are  showing.  I 
studied  them  the  maximum  I  could  with  my 
staff   and my analysts. We watched everything 
in the Premier League, we watched everything 
in the two matches, Twente and Porto – there 
is work there. They will succeed sooner or lat-
er. Hopefully sooner and hopefully before one 
day I go back to the Premier League and they 
become  my  opponents.  At  this  moment  they 
are just my opponents for one match.”

Mourinho,  who  managed  United  between 
2016  and  2018,  winning  the  League  Cup  and 
Europa League, was asked why his former club 
had struggled over the past decade. “Honestly, 
I didn’t lose one minute thinking about it,” he 
said. “I wish the best to Man Utd since the mo-
ment I left.

“I left with a good feeling for the club, with 
a good feeling for the fans and I want the best 
for them, so if things are not going amazingly 
well for them it’s not something that makes me 
happy, but at the same time I have no time.”

The  61-year-old  suggested  that  during  his 
own reign at Old Traff  ord, the United hierar-
chy had not had the same patience they were 
showing towards Ten Hag. 

“What happened for sure, because it’s very 
objective,  is  that  they  kept  faith  with  the 
coach, they support the coach, who is staying 
season  after  season  and  that  means  stability, 
means trust and they are giving him conditions 
to keep developing his job,” he said. “That was 
a  diff  erence  in  relation  to  me  because  as  you 
know we won the Europa League, we ﬁ  nished 
second in the Premier League.”

Fenerbahce coach Jose Mourinho during a training session in Istanbul yesterday, on the eve of 
the Europa League match against Manchester United. (Reuters)

coach in June following his sacking by Roma, 
said United would be at “maximum strength” 
for  the  match  in  Istanbul. “One  thing  are  the 
results that Manchester United are having and 
another thing is the potential of the team,” he 
said. “The potential of the team is high.”

the two biggest candidates to win the Europa 
League, I think it’s easy – Manchester United 
and Tottenham. The Premier League is a dif-
ferent level of quality, intensity, pace, tactical 
culture  –  a  diff  erent  level  of  everything.  To-
morrow,  I  think  we  are  going  to  play  against 
one of the two strongest teams.”

Mourinho,  who  was  named  as  Fenerbahce 

He  added:  “If  I  have  to  say  now  which  are 

CHAMPIONS LAEGUE

England’s James Hillier (also left) is one of the world’s leading motorcycle road racers. 

SPOTLIGHT

Emery already one of 
‘Villa’s greats’: McGinn

AFP
London

John  McGinn  says  Unai 

Emery has already cemented 
his  position  as  one  of  Aston 
Villa’s  greatest  managers  as 
the Spaniard celebrates two years in 
charge sitting atop the Champions 
League  table.  The  former  Arsenal 
boss,  who  was  appointed  on 
October 24, 2022, enjoyed an early 
anniversary  present  as  his  side 
went top of the Champions League 
table  with  a  2-0  win  over  Bologna 
at  Villa  Park  on  Tuesday  for  three 
wins out of three. 

They  are  also  off    to  their  best 
Premier  League  start  since  1998, 
with  ﬁ ve  wins  from  eight  games 
putting them fourth in the table.

It  is  an  extraordinary  turna-
round  for  the  Birmingham-based 
club,  who  were  deep  in  relegation 
trouble  when  Emery  took  over 
from Steven Gerrard. 

Villa  captain  McGinn  said  Em-
ery,  who  won  the  Europa  League 
three  times  with  Sevilla  and  once 
with Villarreal, had already proved 
himself among Villa’s elite.

“We  are  excited.  I  think  the 
manager  is  the  only  person  who 
does  not  get  excited,”  said  the 
Scotland international, who scored 
the  opening  goal  against  Bologna. 
“He just focuses his full energy all 
the  time,  like  he  says  every  single 
day he is that demanding on us. He 
does not let us take our foot off   the 
gas  so  we  can  use  energy  and  en-
thusiasm, the excitement we have, 

but  his  determination  and  inten-
sity is unmatched. No matter what 
happens  until  now  and  whenever 
he leaves – we hope it’s never – he 
will  certainly  go  down  as  one  of 
our club’s greatest managers.”

Villa 

followed  up  victories 
over  Young  Boys  and  Bayern  Mu-
nich  with  a  comfortable  win  over 
the  Serie  A  side  to  make  it  nine 
points  from  nine  in  the  Champi-
ons  League.  That  could  already 
be  enough  to  ensure  they  make  it 
through  to  the  play-off    round  of 
the  revamped  competition,  but 
their  eyes  are  on  ﬁ  nishing  in  the 
top eight and qualifying automati-
cally for the last 16.

“We  are  proud  of  where  we 
are,  top  of  the  league  table  at  the 
minute,”  McGinn  said  before  yes-
terday’s  ﬁ  xtures. “It  has  put  us  in 
a great position to go and kick on. 
Our aim is obviously to qualify ﬁ  rst 
and  foremost  for  the  next  round, 
but  if  we  can  take  it  into  the  top 
eight and carry this on it would be 
brilliant.”

Arteta counts cost of Arsenal 
win as injuries stack up

London:  Arsenal manager Mikel 
Arteta said his side’s growing 
injury list was becoming a worry 
after Riccardo Calafiori limped 
off  near the end of a scrappy 1-0 
win over Shakhtar Donetsk in the 
Champions League on Tuesday.
The London club started 
without captain and long-term 
absentee Martin Odegaard 
and forward Bukayo Saka and 
defender Calafiori now also looks 
like a doubt for Sunday’s crunch 
Premier League game against 
Liverpool after injuring his knee. 
Jurrien Timber is also struggling 
to be fit for the visit of Liverpool 
while central defender William 
Saliba will be missing after his red 
card in the defeat at Bournemouth 
at the weekend.

“With Riccy he had to come off  

because he felt something. I don’t 
know the extent of it but it’s not 
good news, it’s a bit of a worry,” 
Arteta, whose side have seven 
points from their opening three 
Champions League games, told 
reporters.

Arsenal fans will be happy to 
learn that full back Ben White’s 
substitution at halftime was not 
injury-related but because he had 
picked up a yellow card. “It was 
my decision to take him out. He 
had a yellow card, we have played 
enough with 10 men in recent 
periods,” Arteta said. “They had 
a lot of density, a lot of attacking 
players on that side and we didn’t 
want to take any chances.”

Arteta sounded pessimistic 
about the chances of Saka return-
ing against leaders Liverpool.

Ancelotti lauds ‘extraordinary’ Vinicius aft  er win against Dortmund

Reuters
Madrid

Real  Madrid  manager  Carlo 

Ancelotti  praised  the  ‘extraor-
dinary’  Vinicius  Jr  on  Tuesday 
after the Brazilian forward scored 
a second-half hat-trick to help them ﬁ  ght 
back from two goals down and thrash visi-
tors Borussia Dortmund 5-2 in the Cham-
pions League.

Ancelotti told a press conference he was 
convinced  that  the  24-year-old  Vinicius 
would  win  the  Ballon  d’Or  award  for  the 
best player in the world on Monday. 

“What I can say is that it’s rare to see a 
player who plays a second half like Vinicius 
did. And not because of the three goals but 
because  of  his  character;  he’s  extraordi-

nary,” Ancelotti said. “Vinicius is going to 
win (the Ballon d’Or), not for what he did 
tonight, but for what he did last year. These 
three  goals  are  already  going  to  count  for 
next year’s Ballon d’Or, that’s for sure. He 
is a player who gets whistled at because he 
can make a diff  erence.”

In a rematch of last season’s ﬁ  nal, Ance-
lotti said there was no panic in the chang-
ing room after Real went into the halftime 
break two goals down, and that his side had 
the maturity and experience to understand 
what they needed to do to come back. “We 
lived it calmly, calmly (over the break). We 
changed the system and came back playing 
more intensely,” Ancelotti said.

“Talking  about  scoring  three  goals 
might  have  seemed  utopian,  so  we  talked 
about small details like passing well, win-
ning duels... We had to win the dynamic of 

the  game  and  from  there  you  start  to  win 
the  game.  We  were  timid  in  the  ﬁ  rst  half, 
we  weren’t  intense  on  the  ball  and  in  the 
second half we did better with more qual-
ity, more pressure. It was the best second 
half of the season. 

“We  have  to  learn  from  what  we  did 
in the second half. The aim is to start the 
game and not wait for them to put two past 
us.  I  don’t  think  we  can  play  90  minutes 
with  the  intensity  of  the  second  half  but 
we can be more balanced.”

DORTMUND’S SAHIN TAKES BLAME 
FOR DEFENSIVE CHANGES IN LOSS
Meanwhile,  Dortmund  manager  Nuri  Sa-
hin took the blame for the loss, saying that 
his decision to reinforce his defence while 
leading 2-0 had an impact in their ﬁ  rst loss 
in the competition.

Dortmund went into Tuesday’s game on 
the  back  of  two  consecutive  wins  to  start 
the  Champions  League  season  but  were 
thrashed  by  Real  Madrid.  The  home  side 
scored ﬁ ve goals following Sahin’s decision 
to replace scorers Donyell Malen and Jamie 
Bynoe-Gittens  with  defender  Waldemar 
Anton and holding midﬁ  elder Pascal Gross 
early in the second half.

“It’s not easy to explain, of course. We, 
who  I  thought  played  well  with  the  ball, 
really had a lot of solutions. The boys did 
well, scored two goals and then went into 
halftime  and  we  knew  it  would  be  very 
long.  The  second  half  very,  very  long,” 
Sahin  said.  “We  noticed  in  the  second 
half  that  we  were  being  pushed  back,  we 
had  defensive  problems  and  I  thought  we 
should  go  to  the  three-man  defence,  and 
